{
  "schema_version": "0.1.0",
  "student": {
    "name": "Alex Rivera",
    "email": "alex.rivera@university.edu",
    "school": "State University"
  },
  "host": {
    "name": "Dr. Jordan Lee",
    "credential_tier": "licensed"
  },
  "site": {
    "name": "Riverside Community Hospital",
    "location": "Austin, TX"
  },
  "specialty": "Emergency Medicine",
  "started_at": "2026-06-10T14:00:00-05:00",
  "ended_at": "2026-06-10T18:00:00-05:00",
  "hours": 4,
  "mode": "in_person",
  "verification": {
    "status": "verified",
    "verified_at": "2026-06-10T18:05:00-05:00",
    "verifier_name": "Dr. Jordan Lee"
  }
}
